{"$schema":"https://json-schema.org/draft/2020-12/schema","title":"Redacted Notion protocol fixture","type":"object","required":["schema_version","direction","transport","payload"],"properties":{"schema_version":{"const":1},"direction":{"enum":["request","response","event"]},"transport":{"type":"string","minLength":1},"metadata":{"type":"object","additionalProperties":{"type":"string"}},"payload":{}},"additionalProperties":false}
